{
  "$schema": "./game.manifest.schema.json",
  "id": "mpgd.phaser-starter",
  "version": "0.1.0",
  "engine": "phaser-4",
  "intent": "Minimal mpgd starter showing platform, target-config, i18n, game-services, asset, and simulation boundaries.",
  "targets": [
    "web-preview",
    "microsoft-store",
    "verse8",
    "crazygames",
    "oneplay",
    "android",
    "ios",
    "ait",
    "reddit",
    "wechat"
  ],
  "futureTargets": [
    "telegram",
    "tauri"
  ],
  "agentWorkflow": {
    "brief": "agent/brief.template.md",
    "acceptance": "agent/acceptance.md",
    "mcp": [
      {
        "target": "ait",
        "server": "apps-in-toss",
        "queries": [
          "\uc6f9\ubdf0 \uac1c\ubc1c",
          "\uc778\uc571 \uacb0\uc81c",
          "\uc778\uc571 \uad11\uace0",
          "\uc0ac\uc6a9\uc790 \uc2dd\ubcc4\ud0a4",
          "\uacf5\uc720 \ub9c1\ud06c",
          "\uc54c\ub9bc \ub3d9\uc758",
          "\uc0cc\ub4dc\ubc15\uc2a4",
          "\uc2ec\uc0ac",
          "\uc800\uc7a5\uc18c"
        ]
      },
      {
        "target": "reddit",
        "server": "devvit",
        "queries": [
          "Devvit Web",
          "devvit.json",
          "Vite",
          "view modes entry points",
          "showShareSheet getShareData",
          "push notifications",
          "Redis",
          "playtest",
          "payments"
        ]
      }
    ]
  },
  "blocks": [
    {
      "id": "runtime.scene.shell",
      "kind": "scene",
      "entry": "src/scenes/StarterScene.ts",
      "capabilities": [
        "scene-shell",
        "i18n",
        "target-summary",
        "viewport-orientation-summary"
      ],
      "gotchas": [
        "Keep dense HUD or settings in DOM overlays for downstream games.",
        "Do not make the scene the source of truth for progression.",
        "Treat orientation locks as soft prompts unless the active platform adapter explicitly supports hard locking."
      ]
    },
    {
      "id": "simulation.loop.phase",
      "kind": "simulation",
      "entry": "src/game/simulation/state.ts",
      "capabilities": [
        "deterministic-state",
        "fixed-boundary"
      ],
      "gotchas": [
        "Save serializable state only.",
        "Do not store Phaser objects in simulation state."
      ]
    },
    {
      "id": "platform.gateway.target-config",
      "kind": "platform",
      "entry": "src/platform/installStarterPlatform.ts",
      "capabilities": [
        "platform-gateway",
        "effective-target-config",
        "feature-availability",
        "viewport-orientation-policy"
      ],
      "gotchas": [
        "Keep SDK imports out of starter scenes.",
        "Use target-config as the source of feature availability.",
        "Choose responsive, preferred, or locked orientation policy before adding resize behavior."
      ]
    },
    {
      "id": "platform.ui.text-selection",
      "kind": "platform",
      "entry": "src/platform/textSelection.ts",
      "capabilities": [
        "text-selection-policy",
        "selectable-opt-in"
      ],
      "gotchas": [
        "Selection is disabled game-wide by default through mpgd.game.json ui.textSelection; input fields, textareas, and contenteditable hosts stay selectable automatically.",
        "Re-enable selection per element with markSelectable; entry.ts and gameEntry.ts install the policy before any target UI renders."
      ]
    },
    {
      "id": "services.backend.game-services",
      "kind": "service",
      "entry": "src/platform/gameServices.ts",
      "capabilities": [
        "ledger-first",
        "http-transport",
        "orpc-transport"
      ],
      "gotchas": [
        "Treat platform callbacks as evidence, not grants.",
        "Require backend ledger APIs for purchase, ad reward, and leaderboard records."
      ]
    },
    {
      "id": "platform.gateway.bootstrap-intents",
      "kind": "platform",
      "entry": "src/bootstrap.ts",
      "capabilities": [
        "identity-session",
        "launch-intent"
      ],
      "gotchas": [
        "Fall back to a local guest and home intent when an older host does not implement additive methods.",
        "Use the server-verified session player ID for backend services when it is available."
      ]
    },
    {
      "id": "runtime.viewport.safe-area-contract",
      "kind": "runtime",
      "entry": "src/bootstrap.ts",
      "capabilities": [
        "viewport-safe-area-snapshot",
        "viewport-safe-content-bounds"
      ],
      "gotchas": [
        "Reserve safe area exactly once: use outer CSS padding or snapshot safeArea.contentBounds, never both.",
        "Read CSS env-derived insets only for a full-bleed game surface; a CSS-padded game container already excludes those insets."
      ]
    },
    {
      "id": "platform.devvit.view-modes",
      "kind": "platform",
      "entry": "src/platform/devvitEntrypoint.ts",
      "capabilities": [
        "inline-mode-launch-screen",
        "inline-mode-preview",
        "expanded-mode-game-entry",
        "expanded-mode-gameplay",
        "deferred-phaser-load"
      ],
      "gotchas": [
        "Keep the inline preview independent of Phaser and game runtime imports; the generated default loads gameplay only from the expanded game document.",
        "Keep the expanded mode game document mapped to the game entrypoint in devvit.json.",
        "Treat inline gameplay as a separate adapter opt-in that requires a current Reddit gesture and scroll-policy review.",
        "Use the Devvit adapter web API instead of importing the Devvit SDK in game code."
      ]
    },
    {
      "id": "runtime.minigame.canvas-artifact",
      "kind": "runtime",
      "entry": "src/platform/minigameRuntime/wechat.ts",
      "capabilities": [
        "native-minigame-globals",
        "canvas-renderer",
        "runtime-before-game-bundle",
        "static-artifact-evidence",
        "remote-asset-origin-allowlist"
      ],
      "gotchas": [
        "Keep WeChat SDK access in the adapter and runtime host; scenes continue to use PlatformGateway.",
        "Canvas is the only enabled renderer, and audio remains blocked by artifact preflight.",
        "Declare every remote non-code asset origin in the target allowlist and configure the same domain in the WeChat Developer Portal.",
        "Remote WeChat transport requires base library 3.2.2 or newer and disables automatic redirects with the native manual redirect policy so an allowlisted origin cannot silently redirect asset loading elsewhere.",
        "Keep image, spritesheet, and atlas textures package-local because native HTTPS Image redirects cannot be verified and are blocked by the experimental runtime.",
        "Treat static artifact verification as experimental evidence, not DevTools or real-device approval."
      ]
    },
    {
      "id": "assets.manifest.stable-keys",
      "kind": "asset",
      "entry": "src/game/assets/manifest.ts",
      "capabilities": [
        "stable-asset-keys",
        "public-assets"
      ],
      "gotchas": [
        "Do not let raw file names become the gameplay API.",
        "Register every runtime asset in the manifest."
      ]
    },
    {
      "id": "runtime.game.owned-presentation",
      "kind": "platform",
      "entry": "src/bootstrap.ts",
      "capabilities": [
        "game-owned-execution",
        "shared-full-screen-presentation",
        "late-claim-recovery",
        "game-owned-audio"
      ],
      "gotchas": [
        "Create one game runtime above scene lifetimes; scene teardown must not release native presentation or global audio.",
        "Rewarded v2 requires an application-owned durable encrypted operation journal; never substitute an in-memory map.",
        "SDK earning and physical closure are separate from an authoritative backend ledger grant.",
        "Recover existing claims on startup and resume without reopening SDK UI."
      ]
    },
    {
      "id": "commerce.checkout.verified-intent",
      "kind": "platform",
      "entry": "src/platform/buildGateways/oneplay.ts",
      "capabilities": [
        "server-issued-checkout-intent",
        "managed-purchase-verification",
        "ledger-before-finalization",
        "signed-notification-recovery",
        "durable-cancellation-fence",
        "native-checkout-presentation",
        "server-issued-ad-request",
        "signed-reward-ssv"
      ],
      "gotchas": [
        "ONE play monetization stays unavailable without game-owned authenticated issuer routes and durable intent, receipt, ledger and encrypted client recovery stores.",
        "SDK player IDs are platform asserted, not authenticated backend identities. Client ad or purchase callbacks never grant.",
        "Require completed consume/acknowledge before accepting PNS; implement atomic cancellation fencing and authoritative revocation in the game ledger.",
        "Keep uncertain native outcomes quarantined; SDK resume is not closure proof. Validate issued IDs, SSV, payments and hosting in the real ONE store app."
      ]
    }
  ],
  "acceptance": {
    "commands": [
      "pnpm validate:starter-workflow",
      "pnpm game:icons:generate",
      "pnpm game:icons:verify",
      "pnpm check",
      "pnpm --dir examples/phaser-starter check",
      "pnpm --dir examples/phaser-starter build",
      "pnpm build:wechat",
      "pnpm smoke:wechat",
      "pnpm build:oneplay",
      "pnpm smoke:target oneplay"
    ],
    "manual": [
      "Target, player, effective config, and backend mode render on the starter screen.",
      "Starter context resolves an identity session and launch intent without scene-level SDK imports.",
      "Pointer or Enter starts the play scene.",
      "The play scene updates from serializable simulation state.",
      "Viewport orientation policy is visible and does not force unsafe WebView hard locks.",